Comapny name,Previous Close,Open,Bid,Ask,Day's Range,52 Week Range,Volume,Avg. Volume
"Facebook, Inc. (FB) Stock Price, Quote, History & News - Yahoo Finance",210.85,210.30,211.53 x 1000,211.99 x 1000,209.93 - 212.80,159.28 - 224.20,"12,242,530","14,191,561"
"Moderna, Inc. (MRNA) Stock Price, Quote, History & News - Yahoo Finance",19.88,19.79,23.15 x 800,23.22 x 2900,19.79 - 23.39,11.54 - 29.79,"10,144,169","2,552,041"
"FedEx Corporation (FDX) Stock Price, Quote, History & News - Yahoo Finance",148.63,147.30,155.05 x 3000,155.65 x 1000,146.42 - 157.44,137.78 - 199.32,"6,459,325","2,900,035"
"Amazon.com, Inc. (AMZN) Stock Price, Quote, History & News - Yahoo Finance","2,050.23","2,041.99","2,077.10 x 1300","2,080.00 x 1200","2,038.19 - 2,098.53","1,586.00 - 2,098.53","5,095,347","3,494,145"
"Alphabet Inc. (GOOG) Stock Price, Quote, History & News - Yahoo Finance","1,476.23","1,467.30","1,477.01 x 800","1,479.23 x 1000","1,466.35 - 1,485.84","1,025.00 - 1,503.21","1,129,751","1,454,204"
"AbbVie Inc. (ABBV) Stock Price, Quote, History & News - Yahoo Finance",87.18,89.74,91.85 x 1100,92.53 x 1800,88.88 - 92.98,62.66 - 92.98,"18,898,202","8,156,998"
